Filename,Name,Email,Phone,Skills,Organizations,Total Skills
resume_anjali_patel.txt,Matplotlib,anjali.patel2024@email.com,+91-9988776655,"nlp, scikit-learn, java, machine learning, python","JavaScript, INTERNSHIPS

Data Analytics Intern, SQL",14
resume_priya_sharma.txt,Machine Learning,priya.sharma@email.com,+91-9876543210,"scikit-learn, docker, java, aws, machine learning","Data Scientist, CERTIFICATIONS, Google Data Analytics Professional Certificate",11
resume_rahul_verma.txt,"Jamshedpur
Completed",rahul.verma@gmail.com,+91-9123456789,git,"MediaHub Agency, Marketing Today, Content Strategy",1
